school_name,district,total,perc_frl,perc_black,perc_hisp,perc_white,perc_migrant,perc_esol,exclusionary,exclusionary_ps,district_size,d_black,d_hisp,d_white,d_esol,d_migrant,d_frl,school_name_unique,year,fac_schtype
Indian Creek Middle School,Newton County,1008,60.52,30,5,61,0,0.6,218,0.216269841269841,18869,53.0027028459378,6.94620806614023,35.0446764534422,2.5235147596587,0,68.3643860299963,Indian Creek Middle School_Newton County,2015,M
East Newton Elementary School,Newton County,482,49.59,29,5,64,0,2.3,26,0.053941908713693,18869,53.0027028459378,6.94620806614023,35.0446764534422,2.5235147596587,0,68.3643860299963,East Newton Elementary School_Newton County,2015,E
Livingston Elementary School,Newton County,470,80,62,5,28,0,2.1,136,0.28936170212766,18869,53.0027028459378,6.94620806614023,35.0446764534422,2.5235147596587,0,68.3643860299963,Livingston Elementary School_Newton County,2015,E
Mansfield Elementary School,Newton County,413,47.94,6,4,86,0,1.2,1,0.00242130750605327,18869,53.0027028459378,6.94620806614023,35.0446764534422,2.5235147596587,0,68.3643860299963,Mansfield Elementary School_Newton County,2015,E
Heard-Mixon Elementary School,Newton County,463,71.92,25,8,63,0,4.3,14,0.0302375809935205,18869,53.0027028459378,6.94620806614023,35.0446764534422,2.5235147596587,0,68.3643860299963,Heard-Mixon Elementary School_Newton County,2015,E
Porterdale Elementary School,Newton County,428,79.44,64,13,17,0,8.9,129,0.301401869158879,18869,53.0027028459378,6.94620806614023,35.0446764534422,2.5235147596587,0,68.3643860299963,Porterdale Elementary School_Newton County,2015,E
Rocky Branch Elementary School,Oconee County,659,17.15,3,4,83,0,2.3,0,0,6966,4.09431524547804,6.60192362905541,81.0037324145851,2.21246052253804,0,21.7041975308642,Rocky Branch Elementary School_Oconee County,2015,E
North Oconee High School,Oconee County,1179,18.91,4,7,81,0,1.1,32,0.0271416454622562,6966,4.09431524547804,6.60192362905541,81.0037324145851,2.21246052253804,0,21.7041975308642,North Oconee High School_Oconee County,2015,H
High Shoals Elementary School,Oconee County,471,21.44,1,8,86,0,1.7,4,0.00849256900212314,6966,4.09431524547804,6.60192362905541,81.0037324145851,2.21246052253804,0,21.7041975308642,High Shoals Elementary School_Oconee County,2015,E
Oconee County Primary School,Oconee County,387,31.52,4,11,72,0,9.6,1,0.00258397932816537,6966,4.09431524547804,6.60192362905541,81.0037324145851,2.21246052253804,0,21.7041975308642,Oconee County Primary School_Oconee County,2015,E
Oconee County Middle School,Oconee County,818,22.86,5,6,84,0,1.8,46,0.0562347188264059,6966,4.09431524547804,6.60192362905541,81.0037324145851,2.21246052253804,0,21.7041975308642,Oconee County Middle School_Oconee County,2015,M
Malcom Bridge Elementary School,Oconee County,539,18.92,4,6,77,0,4.8,9,0.0166975881261596,6966,4.09431524547804,6.60192362905541,81.0037324145851,2.21246052253804,0,21.7041975308642,Malcom Bridge Elementary School_Oconee County,2015,E
Malcom Bridge Middle School,Oconee County,864,22.8,4,8,79,0,1,14,0.0162037037037037,6966,4.09431524547804,6.60192362905541,81.0037324145851,2.21246052253804,0,21.7041975308642,Malcom Bridge Middle School_Oconee County,2015,M
Oconee County High School,Oconee County,1092,20.79,5,5,83,0,0.7,38,0.0347985347985348,6966,4.09431524547804,6.60192362905541,81.0037324145851,2.21246052253804,0,21.7041975308642,Oconee County High School_Oconee County,2015,H
Oconee County Elementary School,Oconee County,444,29.95,7,9,72,0,3.2,13,0.0292792792792793,6966,4.09431524547804,6.60192362905541,81.0037324145851,2.21246052253804,0,21.7041975308642,Oconee County Elementary School_Oconee County,2015,E
Colham Ferry Elementary School,Oconee County,513,20.86,3,5,87,0,1.9,0,0,6966,4.09431524547804,6.60192362905541,81.0037324145851,2.21246052253804,0,21.7041975308642,Colham Ferry Elementary School_Oconee County,2015,E
Oglethorpe County Middle School,Oglethorpe County,525,59.05,18,5,73,0,1.9,67,0.127619047619048,2160,16.9240740740741,7.5962962962963,70.0532407407408,3.0650462962963,0.437962962962963,59.0738657407407,Oglethorpe County Middle School_Oglethorpe County,2015,M
Oglethorpe County Elementary School,Oglethorpe County,500,63,17,9,67,1,5.4,17,0.034,2160,16.9240740740741,7.5962962962963,70.0532407407408,3.0650462962963,0.437962962962963,59.0738657407407,Oglethorpe County Elementary School_Oglethorpe County,2015,E
Oglethorpe County Primary School,Oglethorpe County,446,66.37,17,10,67,1,4.7,5,0.0112107623318386,2160,16.9240740740741,7.5962962962963,70.0532407407408,3.0650462962963,0.437962962962963,59.0738657407407,Oglethorpe County Primary School_Oglethorpe County,2015,E
Oglethorpe County High School,Oglethorpe County,689,51.52,16,7,72,0,1.2,52,0.0754716981132076,2160,16.9240740740741,7.5962962962963,70.0532407407408,3.0650462962963,0.437962962962963,59.0738657407407,Oglethorpe County High School_Oglethorpe County,2015,H
Hiram High School,Paulding County,1636,48.35,38,8,48,0,0.8,172,0.105134474327628,28332,20.9957292107864,8.03444867993788,65.3667231399125,1.22883665113652,0,42.0414330086122,Hiram High School_Paulding County,2015,H
Bessie L. Baggett Elementary,Paulding County,695,55.97,33,10,50,0,3.2,13,0.018705035971223,28332,20.9957292107864,8.03444867993788,65.3667231399125,1.22883665113652,0,42.0414330086122,Bessie L. Baggett Elementary_Paulding County,2015,E
Lillian C. Poole Elementary School,Paulding County,400,49.75,17,9,68,0,2,17,0.0425,28332,20.9957292107864,8.03444867993788,65.3667231399125,1.22883665113652,0,42.0414330086122,Lillian C. Poole Elementary School_Paulding County,2015,E
South Paulding High School,Paulding County,1774,37.49,18,6,71,0,0.2,284,0.160090191657272,28332,20.9957292107864,8.03444867993788,65.3667231399125,1.22883665113652,0,42.0414330086122,South Paulding High School_Paulding County,2015,H
Sammy McClure Sr. Middle School,Paulding County,1166,16.3,8,10,77,0,0.5,74,0.0634648370497427,28332,20.9957292107864,8.03444867993788,65.3667231399125,1.22883665113652,0,42.0414330086122,Sammy McClure Sr. Middle School_Paulding County,2015,M
North Paulding High School,Paulding County,2034,20.06,13,8,76,0,0.2,73,0.035889872173058,28332,20.9957292107864,8.03444867993788,65.3667231399125,1.22883665113652,0,42.0414330086122,North Paulding High School_Paulding County,2015,H
Burnt Hickory Elementary School,Paulding County,885,20.56,5,5,86,0,0.8,21,0.023728813559322,28332,20.9957292107864,8.03444867993788,65.3667231399125,1.22883665113652,0,42.0414330086122,Burnt Hickory Elementary School_Paulding County,2015,E
WC Abney Elementary,Paulding County,937,34.9,14,8,74,0,1.1,20,0.0213447171824973,28332,20.9957292107864,8.03444867993788,65.3667231399125,1.22883665113652,0,42.0414330086122,WC Abney Elementary_Paulding County,2015,E
McGarity Elementary School,Paulding County,539,44.9,29,9,53,0,1.9,6,0.0111317254174397,28332,20.9957292107864,8.03444867993788,65.3667231399125,1.22883665113652,0,42.0414330086122,McGarity Elementary School_Paulding County,2015,E
South Paulding Middle School,Paulding County,506,47.04,11,7,77,0,0.4,124,0.245059288537549,28332,20.9957292107864,8.03444867993788,65.3667231399125,1.22883665113652,0,42.0414330086122,South Paulding Middle School_Paulding County,2015,M
Floyd L. Shelton Elementary School at Crossroad,Paulding County,1064,16.73,11,9,72,0,0.8,17,0.0159774436090226,28332,20.9957292107864,8.03444867993788,65.3667231399125,1.22883665113652,0,42.0414330086122,Floyd L. Shelton Elementary School at Crossroad_Paulding County,2015,E
Sam D. Panter Elementary School,Paulding County,543,56.35,12,7,74,0,1.1,30,0.0552486187845304,28332,20.9957292107864,8.03444867993788,65.3667231399125,1.22883665113652,0,42.0414330086122,Sam D. Panter Elementary School_Paulding County,2015,E
Nebo Elementary School,Paulding County,765,44.58,12,5,76,0,0.8,30,0.0392156862745098,28332,20.9957292107864,8.03444867993788,65.3667231399125,1.22883665113652,0,42.0414330086122,Nebo Elementary School_Paulding County,2015,E
C. A. Roberts Elementary School,Paulding County,625,48.48,12,12,70,0,5.8,15,0.024,28332,20.9957292107864,8.03444867993788,65.3667231399125,1.22883665113652,0,42.0414330086122,C. A. Roberts Elementary School_Paulding County,2015,E
Lena Mae Moses Middle School,Paulding County,575,36.35,19,9,66,0,0.3,54,0.0939130434782609,28332,20.9957292107864,8.03444867993788,65.3667231399125,1.22883665113652,0,42.0414330086122,Lena Mae Moses Middle School_Paulding County,2015,M
Roland W. Russom Elementary,Paulding County,801,27.97,18,6,69,0,2.1,3,0.00374531835205993,28332,20.9957292107864,8.03444867993788,65.3667231399125,1.22883665113652,0,42.0414330086122,Roland W. Russom Elementary_Paulding County,2015,E
Sara M. Ragsdale Elementary,Paulding County,661,54.61,12,5,78,0,0.9,19,0.0287443267776097,28332,20.9957292107864,8.03444867993788,65.3667231399125,1.22883665113652,0,42.0414330086122,Sara M. Ragsdale Elementary_Paulding County,2015,E
P. B. Ritch Middle School,Paulding County,654,57.65,46,10,36,0,2.9,165,0.252293577981651,28332,20.9957292107864,8.03444867993788,65.3667231399125,1.22883665113652,0,42.0414330086122,P. B. Ritch Middle School_Paulding County,2015,M
East Paulding High School,Paulding County,1666,33.97,21,7,67,0,0.5,272,0.163265306122449,28332,20.9957292107864,8.03444867993788,65.3667231399125,1.22883665113652,0,42.0414330086122,East Paulding High School_Paulding County,2015,H
Northside Elementary School,Paulding County,436,47.48,15,9,67,0,0.9,23,0.0527522935779817,28332,20.9957292107864,8.03444867993788,65.3667231399125,1.22883665113652,0,42.0414330086122,Northside Elementary School_Paulding County,2015,E
J. A. Dobbins Middle School,Paulding County,793,55.36,32,10,52,0,0.6,170,0.21437578814628,28332,20.9957292107864,8.03444867993788,65.3667231399125,1.22883665113652,0,42.0414330086122,J. A. Dobbins Middle School_Paulding County,2015,M
Allgood Elementary School,Paulding County,856,62.97,27,11,56,0,3.7,35,0.0408878504672897,28332,20.9957292107864,8.03444867993788,65.3667231399125,1.22883665113652,0,42.0414330086122,Allgood Elementary School_Paulding County,2015,E
Connie Dugan Elementary School,Paulding County,703,43.95,24,9,62,0,1.7,9,0.0128022759601707,28332,20.9957292107864,8.03444867993788,65.3667231399125,1.22883665113652,0,42.0414330086122,Connie Dugan Elementary School_Paulding County,2015,E
Hal Hutchens Elementary,Paulding County,795,49.81,31,10,54,0,2.9,28,0.0352201257861635,28332,20.9957292107864,8.03444867993788,65.3667231399125,1.22883665113652,0,42.0414330086122,Hal Hutchens Elementary_Paulding County,2015,E
East Paulding Middle School,Paulding County,841,31.39,12,7,74,0,0.5,114,0.135552913198573,28332,20.9957292107864,8.03444867993788,65.3667231399125,1.22883665113652,0,42.0414330086122,East Paulding Middle School_Paulding County,2015,M
Irma C. Austin Middle School,Paulding County,877,38.31,24,9,63,0,1,70,0.0798175598631699,28332,20.9957292107864,8.03444867993788,65.3667231399125,1.22883665113652,0,42.0414330086122,Irma C. Austin Middle School_Paulding County,2015,M
Carl Scoggins Sr. Middle school,Paulding County,695,55.25,15,6,75,0,0.4,93,0.133812949640288,28332,20.9957292107864,8.03444867993788,65.3667231399125,1.22883665113652,0,42.0414330086122,Carl Scoggins Sr. Middle school_Paulding County,2015,M
Dallas Elementary School,Paulding County,468,80.34,39,10,43,0,2.8,94,0.200854700854701,28332,20.9957292107864,8.03444867993788,65.3667231399125,1.22883665113652,0,42.0414330086122,Dallas Elementary School_Paulding County,2015,E
New Georgia Elementary School,Paulding County,343,47.23,12,5,79,0,1.7,2,0.00583090379008746,28332,20.9957292107864,8.03444867993788,65.3667231399125,1.22883665113652,0,42.0414330086122,New Georgia Elementary School_Paulding County,2015,E
Herschel Jones Middle School,Paulding County,737,59.97,32,9,52,0,0.4,165,0.223880597014925,28332,20.9957292107864,8.03444867993788,65.3667231399125,1.22883665113652,0,42.0414330086122,Herschel Jones Middle School_Paulding County,2015,M
Paulding County High School,Paulding County,1748,52.75,26,7,62,0,0.3,374,0.21395881006865,28332,20.9957292107864,8.03444867993788,65.3667231399125,1.22883665113652,0,42.0414330086122,Paulding County High School_Paulding County,2015,H
Union Elementary School,Paulding County,481,53.43,7,4,85,0,0.4,4,0.00831600831600832,28332,20.9957292107864,8.03444867993788,65.3667231399125,1.22883665113652,0,42.0414330086122,Union Elementary School_Paulding County,2015,E
Hiram Elementary School,Paulding County,633,60.35,48,13,32,0,5.2,14,0.0221169036334913,28332,20.9957292107864,8.03444867993788,65.3667231399125,1.22883665113652,0,42.0414330086122,Hiram Elementary School_Paulding County,2015,E
Kay Road Elementary,Peach County,511,94.72,41,23,33,0,11.5,26,0.050880626223092,3604,49.9195338512764,13.7164261931188,32.8135405105438,4.40471698113208,0,83.3797197558269,Kay Road Elementary_Peach County,2015,E
Fort Valley Middle School,Peach County,475,94.74,68,21,9,0,4.6,169,0.355789473684211,3604,49.9195338512764,13.7164261931188,32.8135405105438,4.40471698113208,0,83.3797197558269,Fort Valley Middle School_Peach County,2015,M
Byron Middle School,Peach County,394,52.54,28,6,58,0,0.3,34,0.0862944162436548,3604,49.9195338512764,13.7164261931188,32.8135405105438,4.40471698113208,0,83.3797197558269,Byron Middle School_Peach County,2015,M
Hunt Elementary School,Peach County,648,94.75,78,13,8,0,8.8,55,0.0848765432098766,3604,49.9195338512764,13.7164261931188,32.8135405105438,4.40471698113208,0,83.3797197558269,Hunt Elementary School_Peach County,2015,E
Byron Elementary School,Peach County,595,94.62,22,7,65,0,1.7,13,0.0218487394957983,3604,49.9195338512764,13.7164261931188,32.8135405105438,4.40471698113208,0,83.3797197558269,Byron Elementary School_Peach County,2015,E
Peach County High School,Peach County,981,70.03,53,13,31,0,1,157,0.160040774719674,3604,49.9195338512764,13.7164261931188,32.8135405105438,4.40471698113208,0,83.3797197558269,Peach County High School_Peach County,2015,H
Hill City Elementary School,Pickens County,557,56.91,0,2,96,0,0,12,0.0215439856373429,4272,0.877808988764045,4.95201310861423,91.5994850187266,0.621722846441948,0,53.370002340824,Hill City Elementary School_Pickens County,2015,E
Harmony Elementary School,Pickens County,509,58.55,1,5,91,0,0,6,0.0117878192534381,4272,0.877808988764045,4.95201310861423,91.5994850187266,0.621722846441948,0,53.370002340824,Harmony Elementary School_Pickens County,2015,E
Pickens County Middle School,Pickens County,525,54.63,2,4,92,0,0,17,0.0323809523809524,4272,0.877808988764045,4.95201310861423,91.5994850187266,0.621722846441948,0,53.370002340824,Pickens County Middle School_Pickens County,2015,
Pickens County High School,Pickens County,1285,48.4,1,4,92,0,0.2,40,0.0311284046692607,4272,0.877808988764045,4.95201310861423,91.5994850187266,0.621722846441948,0,53.370002340824,Pickens County High School_Pickens County,2015,H
Jasper Elementary School,Pickens County,490,43.85,0,13,85,0,4.3,2,0.00408163265306122,4272,0.877808988764045,4.95201310861423,91.5994850187266,0.621722846441948,0,53.370002340824,Jasper Elementary School_Pickens County,2015,
Tate Elementary School,Pickens County,322,57.45,1,3,92,0,0,10,0.031055900621118,4272,0.877808988764045,4.95201310861423,91.5994850187266,0.621722846441948,0,53.370002340824,Tate Elementary School_Pickens County,2015,E
Jasper Middle School,Pickens County,584,61.02,1,5,92,0,0.5,16,0.0273972602739726,4272,0.877808988764045,4.95201310861423,91.5994850187266,0.621722846441948,0,53.370002340824,Jasper Middle School_Pickens County,2015,M
Midway Elementary School,Pierce County,464,52.16,2,9,86,1,6.5,13,0.0280172413793103,3588,8.75641025641026,7.02257525083612,81.8154960981048,3.29364548494983,0.700947603121516,58.0559253065775,Midway Elementary School_Pierce County,2015,E
Pierce County High School,Pierce County,1073,50.79,10,5,85,0,0.8,142,0.132339235787512,3588,8.75641025641026,7.02257525083612,81.8154960981048,3.29364548494983,0.700947603121516,58.0559253065775,Pierce County High School_Pierce County,2015,H
Pierce County Middle School,Pierce County,861,59.47,8,7,83,1,1.9,110,0.127758420441347,3588,8.75641025641026,7.02257525083612,81.8154960981048,3.29364548494983,0.700947603121516,58.0559253065775,Pierce County Middle School_Pierce County,2015,M
Blackshear Elementary School,Pierce County,757,70.81,13,7,75,1,4.9,8,0.0105680317040951,3588,8.75641025641026,7.02257525083612,81.8154960981048,3.29364548494983,0.700947603121516,58.0559253065775,Blackshear Elementary School_Pierce County,2015,E
Patterson Elementary School,Pierce County,433,57.27,7,10,79,1,6,19,0.0438799076212471,3588,8.75641025641026,7.02257525083612,81.8154960981048,3.29364548494983,0.700947603121516,58.0559253065775,Patterson Elementary School_Pierce County,2015,E
Pike County Elementary School,Pike County,747,43.24,7,1,88,0,0.4,11,0.0147255689424364,3340,7.63263473053892,1.19011976047904,87.9535928143713,0.205119760479042,0,41.1992305389222,Pike County Elementary School_Pike County,2015,E
Pike County Primary School,Pike County,635,46.93,9,2,86,0,0.3,8,0.0125984251968504,3340,7.63263473053892,1.19011976047904,87.9535928143713,0.205119760479042,0,41.1992305389222,Pike County Primary School_Pike County,2015,E
Pike County High School,Pike County,1115,34.98,7,1,89,0,0.1,154,0.138116591928251,3340,7.63263473053892,1.19011976047904,87.9535928143713,0.205119760479042,0,41.1992305389222,Pike County High School_Pike County,2015,H
Pike County Middle School,Pike County,843,43.3,8,1,88,0,0.1,175,0.207591933570581,3340,7.63263473053892,1.19011976047904,87.9535928143713,0.205119760479042,0,41.1992305389222,Pike County Middle School_Pike County,2015,M
Rockmart High School,Polk County,885,83.05,14,4,77,0,0.2,69,0.0779661016949153,7396,14.4917522985398,19.7514872904273,60.6195240670633,6.62285018929151,0.123309897241752,82.9540319091401,Rockmart High School_Polk County,2015,H
Cedartown Middle School,Polk County,979,83.15,15,29,53,0,2.9,202,0.206332992849847,7396,14.4917522985398,19.7514872904273,60.6195240670633,6.62285018929151,0.123309897241752,82.9540319091401,Cedartown Middle School_Polk County,2015,M
Rockmart Middle School,Polk County,706,83.14,14,3,77,0,0.6,131,0.185552407932011,7396,14.4917522985398,19.7514872904273,60.6195240670633,6.62285018929151,0.123309897241752,82.9540319091401,Rockmart Middle School_Polk County,2015,M
Westside Elementary School,Polk County,555,83.06,20,30,46,0,12.3,60,0.108108108108108,7396,14.4917522985398,19.7514872904273,60.6195240670633,6.62285018929151,0.123309897241752,82.9540319091401,Westside Elementary School_Polk County,2015,E
Cherokee Elementary School,Polk County,545,83.12,9,43,42,0,25.5,6,0.0110091743119266,7396,14.4917522985398,19.7514872904273,60.6195240670633,6.62285018929151,0.123309897241752,82.9540319091401,Cherokee Elementary School_Polk County,2015,E
Northside Elementary,Polk County,456,83.11,13,50,33,2,27,16,0.0350877192982456,7396,14.4917522985398,19.7514872904273,60.6195240670633,6.62285018929151,0.123309897241752,82.9540319091401,Northside Elementary_Polk County,2015,E
Harpst Academy,Polk County,54,63.31,20,2,69,0,0,344,6.37037037037037,7396,14.4917522985398,19.7514872904273,60.6195240670633,6.62285018929151,0.123309897241752,82.9540319091401,Harpst Academy_Polk County,2015,H
Van Wert Elementary School,Polk County,715,83.08,25,5,61,0,1.7,119,0.166433566433566,7396,14.4917522985398,19.7514872904273,60.6195240670633,6.62285018929151,0.123309897241752,82.9540319091401,Van Wert Elementary School_Polk County,2015,E
Eastside Elementary School,Polk County,779,83.06,12,3,79,0,0.6,36,0.0462130937098845,7396,14.4917522985398,19.7514872904273,60.6195240670633,6.62285018929151,0.123309897241752,82.9540319091401,Eastside Elementary School_Polk County,2015,E
Youngs Grove Elementary School,Polk County,600,83.17,9,27,59,0,14.3,8,0.0133333333333333,7396,14.4917522985398,19.7514872904273,60.6195240670633,6.62285018929151,0.123309897241752,82.9540319091401,Youngs Grove Elementary School_Polk County,2015,E
Cedartown High School,Polk County,1122,83.07,13,24,59,0,2,21,0.018716577540107,7396,14.4917522985398,19.7514872904273,60.6195240670633,6.62285018929151,0.123309897241752,82.9540319091401,Cedartown High School_Polk County,2015,H
Pulaski County Middle School,Pulaski County,314,70.06,39,6,50,1,0,103,0.328025477707006,1321,37.1907645722937,6.67070401211204,51.331566994701,1.14640423921272,0.237698713096139,69.4144057532173,Pulaski County Middle School_Pulaski County,2015,M
Hawkinsville High School,Pulaski County,376,61.7,36,5,53,0,0,93,0.247340425531915,1321,37.1907645722937,6.67070401211204,51.331566994701,1.14640423921272,0.237698713096139,69.4144057532173,Hawkinsville High School_Pulaski County,2015,H
Pulaski County Elementary School,Pulaski County,631,73.69,37,8,51,0,2.4,82,0.129952456418384,1321,37.1907645722937,6.67070401211204,51.331566994701,1.14640423921272,0.237698713096139,69.4144057532173,Pulaski County Elementary School_Pulaski County,2015,E
Putnam County Middle School,Putnam County,655,74.96,40,11,46,0,0.9,275,0.419847328244275,2709,40.2473237356958,11.8538205980066,43.3624953857512,4.36356589147287,0.506829088224437,75.5613141380583,Putnam County Middle School_Putnam County,2015,M
Putnam County Primary School,Putnam County,735,77.82,39,16,39,1,11.6,6,0.00816326530612245,2709,40.2473237356958,11.8538205980066,43.3624953857512,4.36356589147287,0.506829088224437,75.5613141380583,Putnam County Primary School_Putnam County,2015,E
Putnam County Elementary School,Putnam County,638,79.47,39,11,45,1,3.6,12,0.0188087774294671,2709,40.2473237356958,11.8538205980066,43.3624953857512,4.36356589147287,0.506829088224437,75.5613141380583,Putnam County Elementary School_Putnam County,2015,E
Putnam County High School,Putnam County,681,70.04,43,9,44,0,0.6,431,0.632892804698972,2709,40.2473237356958,11.8538205980066,43.3624953857512,4.36356589147287,0.506829088224437,75.5613141380583,Putnam County High School_Putnam County,2015,H
Quitman County High School,Quitman County,71,92.32,86,0,14,0,0,13,0.183098591549296,300,74.55,0,23.16,0,0,76.6106,Quitman County High School_Quitman County,2015,H
Quitman County Elementary,Quitman County,229,71.74,71,0,26,0,0,60,0.262008733624454,300,74.55,0,23.16,0,0,76.6106,Quitman County Elementary_Quitman County,2015,E
Rabun County Middle School,Rabun County,341,66.86,0,15,83,0,0.9,2,0.00586510263929619,2159,0.547938860583604,16.1843446039833,80.9527559055118,4.32329782306623,0,66.0011069939787,Rabun County Middle School_Rabun County,2015,M
Rabun County Elementary School,Rabun County,635,67.87,0,18,80,0,2.4,15,0.0236220472440945,2159,0.547938860583604,16.1843446039833,80.9527559055118,4.32329782306623,0,66.0011069939787,Rabun County Elementary School_Rabun County,2015,E
Rabun County Primary School,Rabun County,503,74.16,1,19,78,0,13.7,5,0.0099403578528827,2159,0.547938860583604,16.1843446039833,80.9527559055118,4.32329782306623,0,66.0011069939787,Rabun County Primary School_Rabun County,2015,E
Rabun County High School,Rabun County,680,57.79,1,13,83,0,0.9,31,0.0455882352941176,2159,0.547938860583604,16.1843446039833,80.9527559055118,4.32329782306623,0,66.0011069939787,Rabun County High School_Rabun County,2015,H
Randolph Clay Middle School,Randolph County,174,89.08,96,2,2,0,0,54,0.310344827586207,912,94.5175438596491,1.29824561403509,3.26754385964912,0,0,90.1317324561404,Randolph Clay Middle School_Randolph County,2015,M
Randolph Clay High School,Randolph County,320,89.06,97,0,3,0,0,209,0.653125,912,94.5175438596491,1.29824561403509,3.26754385964912,0,0,90.1317324561404,Randolph Clay High School_Randolph County,2015,H
Randolph County Elementary School,Randolph County,418,91.39,92,2,4,0,0,206,0.492822966507177,912,94.5175438596491,1.29824561403509,3.26754385964912,0,0,90.1317324561404,Randolph County Elementary School_Randolph County,2015,E
Cross Creek High School,Richmond County,1279,87.21,65,2,29,0,0.2,586,0.458170445660672,33621,66.6628297790072,5.05966509027096,23.1936884685167,1.18072633175694,0,72.5014678326046,Cross Creek High School_Richmond County,2015,H
Craig-Houghton Elementary School,Richmond County,402,80.67,98,0,1,0,0,429,1.06716417910448,33621,66.6628297790072,5.05966509027096,23.1936884685167,1.18072633175694,0,72.5014678326046,Craig-Houghton Elementary School_Richmond County,2015,
Hephzibah Elementary School,Richmond County,422,67.51,34,4,56,0,0,87,0.206161137440758,33621,66.6628297790072,5.05966509027096,23.1936884685167,1.18072633175694,0,72.5014678326046,Hephzibah Elementary School_Richmond County,2015,E
Freedom Park Elementary,Richmond County,745,44.13,32,17,40,0,2.1,32,0.0429530201342282,33621,66.6628297790072,5.05966509027096,23.1936884685167,1.18072633175694,0,72.5014678326046,Freedom Park Elementary_Richmond County,2015,E
Wilkinson Gardens Elementary School,Richmond County,460,85.4,93,2,3,0,1.1,62,0.134782608695652,33621,66.6628297790072,5.05966509027096,23.1936884685167,1.18072633175694,0,72.5014678326046,Wilkinson Gardens Elementary School_Richmond County,2015,E
Deer Chase Elementary School,Richmond County,636,80.52,91,2,2,0,0.3,87,0.136792452830189,33621,66.6628297790072,5.05966509027096,23.1936884685167,1.18072633175694,0,72.5014678326046,Deer Chase Elementary School_Richmond County,2015,E
Lighthouse Care Center of Augusta,Richmond County,38,59.34,58,5,26,0,0,0,0,33621,66.6628297790072,5.05966509027096,23.1936884685167,1.18072633175694,0,72.5014678326046,Lighthouse Care Center of Augusta_Richmond County,2015,H
Pine Hill Middle School,Richmond County,607,67.87,50,3,43,0,0,320,0.527182866556837,33621,66.6628297790072,5.05966509027096,23.1936884685167,1.18072633175694,0,72.5014678326046,Pine Hill Middle School_Richmond County,2015,M
W.S. Hornsby K-8 School,Richmond County,1652,73.45,83,10,1,0,0,657,0.397699757869249,33621,66.6628297790072,5.05966509027096,23.1936884685167,1.18072633175694,0,72.5014678326046,W.S. Hornsby K-8 School_Richmond County,2015,
