school_name,district,total,perc_frl,perc_black,perc_hisp,perc_white,perc_migrant,perc_esol,exclusionary,exclusionary_ps,district_size,d_black,d_hisp,d_white,d_esol,d_migrant,d_frl,school_name_unique,year,fac_schtype
Evans Middle School,Columbia County,936,36.54,19,8,61,0,0.5,82,0.0876068376068376,24927,19.5529345689413,8.66827135234886,61.814057046576,1.2131062703093,0,33.2117892245356,Evans Middle School_Columbia County,2015,M
Stallings Island Middle School,Columbia County,561,14.97,10,3,67,0,0.4,12,0.0213903743315508,24927,19.5529345689413,8.66827135234886,61.814057046576,1.2131062703093,0,33.2117892245356,Stallings Island Middle School_Columbia County,2015,M
Grovetown High School,Columbia County,1704,38.5,35,12,45,0,1.2,197,0.115610328638498,24927,19.5529345689413,8.66827135234886,61.814057046576,1.2131062703093,0,33.2117892245356,Grovetown High School_Columbia County,2015,H
Westmont Elementary School,Columbia County,507,48.92,10,9,73,0,1.6,5,0.00986193293885602,24927,19.5529345689413,8.66827135234886,61.814057046576,1.2131062703093,0,33.2117892245356,Westmont Elementary School_Columbia County,2015,E
Harlem High School,Columbia County,669,41.7,14,5,76,0,0,42,0.062780269058296,24927,19.5529345689413,8.66827135234886,61.814057046576,1.2131062703093,0,33.2117892245356,Harlem High School_Columbia County,2015,H
Evans Elementary School,Columbia County,700,35.43,15,8,69,0,0.9,32,0.0457142857142857,24927,19.5529345689413,8.66827135234886,61.814057046576,1.2131062703093,0,33.2117892245356,Evans Elementary School_Columbia County,2015,E
Blue Ridge Elementary School,Columbia County,627,34.93,15,7,60,0,2.2,14,0.0223285486443381,24927,19.5529345689413,8.66827135234886,61.814057046576,1.2131062703093,0,33.2117892245356,Blue Ridge Elementary School_Columbia County,2015,E
Lakeside High School,Columbia County,1563,25.02,18,5,66,0,0.6,118,0.0754958413307742,24927,19.5529345689413,8.66827135234886,61.814057046576,1.2131062703093,0,33.2117892245356,Lakeside High School_Columbia County,2015,H
Brookwood Elementary School,Columbia County,588,54.08,22,13,54,0,3.7,8,0.0136054421768707,24927,19.5529345689413,8.66827135234886,61.814057046576,1.2131062703093,0,33.2117892245356,Brookwood Elementary School_Columbia County,2015,E
Stevens Creek Elementary School,Columbia County,790,16.84,10,4,67,0,3,15,0.0189873417721519,24927,19.5529345689413,8.66827135234886,61.814057046576,1.2131062703093,0,33.2117892245356,Stevens Creek Elementary School_Columbia County,2015,E
Riverside Middle School,Columbia County,706,12.32,13,5,72,0,0.8,18,0.0254957507082153,24927,19.5529345689413,8.66827135234886,61.814057046576,1.2131062703093,0,33.2117892245356,Riverside Middle School_Columbia County,2015,M
Riverside Elementary School,Columbia County,617,12.16,16,5,70,0,0.5,12,0.0194489465153971,24927,19.5529345689413,8.66827135234886,61.814057046576,1.2131062703093,0,33.2117892245356,Riverside Elementary School_Columbia County,2015,E
Greenbrier High School,Columbia County,1782,8.64,15,6,71,0,0.3,92,0.0516273849607183,24927,19.5529345689413,8.66827135234886,61.814057046576,1.2131062703093,0,33.2117892245356,Greenbrier High School_Columbia County,2015,H
Cedar Ridge Elementary School,Columbia County,907,41.23,30,17,40,0,3.1,18,0.019845644983462,24927,19.5529345689413,8.66827135234886,61.814057046576,1.2131062703093,0,33.2117892245356,Cedar Ridge Elementary School_Columbia County,2015,E
Baker Place Elementary,Columbia County,938,28.54,22,15,52,0,1.5,36,0.0383795309168444,24927,19.5529345689413,8.66827135234886,61.814057046576,1.2131062703093,0,33.2117892245356,Baker Place Elementary_Columbia County,2015,E
Harlem Middle School,Columbia County,574,52.61,15,7,74,0,0.5,43,0.0749128919860627,24927,19.5529345689413,8.66827135234886,61.814057046576,1.2131062703093,0,33.2117892245356,Harlem Middle School_Columbia County,2015,M
Lakeside Middle School,Columbia County,723,51.18,25,8,57,0,1.5,117,0.161825726141079,24927,19.5529345689413,8.66827135234886,61.814057046576,1.2131062703093,0,33.2117892245356,Lakeside Middle School_Columbia County,2015,M
Greenbrier Elementary School,Columbia County,977,11.57,13,8,71,0,0,6,0.00614124872057318,24927,19.5529345689413,8.66827135234886,61.814057046576,1.2131062703093,0,33.2117892245356,Greenbrier Elementary School_Columbia County,2015,E
Euchee Creek Elementary School,Columbia County,504,49.6,19,7,64,0,0.4,14,0.0277777777777778,24927,19.5529345689413,8.66827135234886,61.814057046576,1.2131062703093,0,33.2117892245356,Euchee Creek Elementary School_Columbia County,2015,E
Columbia Middle School,Columbia County,1044,36.3,25,9,56,0,0.1,99,0.0948275862068965,24927,19.5529345689413,8.66827135234886,61.814057046576,1.2131062703093,0,33.2117892245356,Columbia Middle School_Columbia County,2015,M
Martinez Elementary School,Columbia County,636,49.69,20,9,59,0,2.8,12,0.0188679245283019,24927,19.5529345689413,8.66827135234886,61.814057046576,1.2131062703093,0,33.2117892245356,Martinez Elementary School_Columbia County,2015,E
North Columbia Elementary School,Columbia County,345,40.29,8,3,85,0,0,26,0.0753623188405797,24927,19.5529345689413,8.66827135234886,61.814057046576,1.2131062703093,0,33.2117892245356,North Columbia Elementary School_Columbia County,2015,E
Evans High School,Columbia County,1780,31.29,20,7,64,0,0.3,177,0.099438202247191,24927,19.5529345689413,8.66827135234886,61.814057046576,1.2131062703093,0,33.2117892245356,Evans High School_Columbia County,2015,H
North Harlem Elementary School,Columbia County,552,63.59,23,8,62,0,1.1,35,0.0634057971014493,24927,19.5529345689413,8.66827135234886,61.814057046576,1.2131062703093,0,33.2117892245356,North Harlem Elementary School_Columbia County,2015,E
Grovetown Elementary School,Columbia County,573,71.9,28,17,46,0,5.2,11,0.0191972076788831,24927,19.5529345689413,8.66827135234886,61.814057046576,1.2131062703093,0,33.2117892245356,Grovetown Elementary School_Columbia County,2015,E
South Columbia Elementary School,Columbia County,531,61.39,26,10,55,0,3.6,23,0.0433145009416196,24927,19.5529345689413,8.66827135234886,61.814057046576,1.2131062703093,0,33.2117892245356,South Columbia Elementary School_Columbia County,2015,E
Cook County Middle School,Cook County,690,86.09,33,9,52,4,0.7,72,0.104347826086957,3123,33.4950368235671,8.50112071725905,53.8258085174512,3.07848222862632,2.92058917707333,86.1362151777138,Cook County Middle School_Cook County,2015,M
Cook Elementary School,Cook County,722,86.15,33,6,56,3,2.5,10,0.0138504155124654,3123,33.4950368235671,8.50112071725905,53.8258085174512,3.07848222862632,2.92058917707333,86.1362151777138,Cook Elementary School_Cook County,2015,E
Cook High School,Cook County,938,86.14,33,8,55,2,1.3,170,0.181236673773987,3123,33.4950368235671,8.50112071725905,53.8258085174512,3.07848222862632,2.92058917707333,86.1362151777138,Cook High School_Cook County,2015,H
Cook Primary School,Cook County,773,86.16,35,11,52,3,7.9,6,0.00776196636481242,3123,33.4950368235671,8.50112071725905,53.8258085174512,3.07848222862632,2.92058917707333,86.1362151777138,Cook Primary School_Cook County,2015,E
Arbor Springs Elementary,Coweta County,406,28.57,8,11,72,0,4.9,9,0.0221674876847291,21713,21.9934601390872,8.22184866209184,63.3158015935154,1.85700732280201,0.0210472988532216,43.798328190485,Arbor Springs Elementary_Coweta County,2015,E
Willis Road Elementary,Coweta County,659,38.69,8,12,73,0,5.6,12,0.0182094081942337,21713,21.9934601390872,8.22184866209184,63.3158015935154,1.85700732280201,0.0210472988532216,43.798328190485,Willis Road Elementary_Coweta County,2015,E
Lee Middle School,Coweta County,947,30.83,15,8,66,0,0,118,0.124604012671595,21713,21.9934601390872,8.22184866209184,63.3158015935154,1.85700732280201,0.0210472988532216,43.798328190485,Lee Middle School_Coweta County,2015,M
Brooks Elementary,Coweta County,636,25.63,10,5,81,0,0,10,0.0157232704402516,21713,21.9934601390872,8.22184866209184,63.3158015935154,1.85700732280201,0.0210472988532216,43.798328190485,Brooks Elementary_Coweta County,2015,E
White Oak Elementary School,Coweta County,649,41.91,21,13,58,0,6.8,14,0.0215716486902928,21713,21.9934601390872,8.22184866209184,63.3158015935154,1.85700732280201,0.0210472988532216,43.798328190485,White Oak Elementary School_Coweta County,2015,E
Canongate Elementary School,Coweta County,553,27.12,5,13,76,0,4.3,9,0.0162748643761302,21713,21.9934601390872,8.22184866209184,63.3158015935154,1.85700732280201,0.0210472988532216,43.798328190485,Canongate Elementary School_Coweta County,2015,E
Newnan Crossing Elementary School,Coweta County,890,43.71,33,10,41,0,3.3,13,0.0146067415730337,21713,21.9934601390872,8.22184866209184,63.3158015935154,1.85700732280201,0.0210472988532216,43.798328190485,Newnan Crossing Elementary School_Coweta County,2015,E
Jefferson Parkway Elementary School,Coweta County,457,74.4,42,24,25,1,13.3,19,0.0415754923413567,21713,21.9934601390872,8.22184866209184,63.3158015935154,1.85700732280201,0.0210472988532216,43.798328190485,Jefferson Parkway Elementary School_Coweta County,2015,E
Northgate High School,Coweta County,1790,24.86,13,7,75,0,0.2,203,0.11340782122905,21713,21.9934601390872,8.22184866209184,63.3158015935154,1.85700732280201,0.0210472988532216,43.798328190485,Northgate High School_Coweta County,2015,H
Poplar Road Elementary School,Coweta County,544,50.18,30,5,63,0,0,27,0.0496323529411765,21713,21.9934601390872,8.22184866209184,63.3158015935154,1.85700732280201,0.0210472988532216,43.798328190485,Poplar Road Elementary School_Coweta County,2015,E
Welch Elementary School,Coweta County,765,59.87,40,12,40,0,5.2,59,0.077124183006536,21713,21.9934601390872,8.22184866209184,63.3158015935154,1.85700732280201,0.0210472988532216,43.798328190485,Welch Elementary School_Coweta County,2015,E
Glanton Elementary,Coweta County,307,73.62,24,5,65,0,0,30,0.0977198697068404,21713,21.9934601390872,8.22184866209184,63.3158015935154,1.85700732280201,0.0210472988532216,43.798328190485,Glanton Elementary_Coweta County,2015,E
East Coweta Middle School,Coweta County,682,44.13,17,5,73,0,0,66,0.0967741935483871,21713,21.9934601390872,8.22184866209184,63.3158015935154,1.85700732280201,0.0210472988532216,43.798328190485,East Coweta Middle School_Coweta County,2015,M
Thomas Crossroads Elementary School,Coweta County,388,21.91,8,8,78,0,0,5,0.0128865979381443,21713,21.9934601390872,8.22184866209184,63.3158015935154,1.85700732280201,0.0210472988532216,43.798328190485,Thomas Crossroads Elementary School_Coweta County,2015,E
Madras Middle School,Coweta County,1061,29.88,12,7,74,0,0,50,0.0471253534401508,21713,21.9934601390872,8.22184866209184,63.3158015935154,1.85700732280201,0.0210472988532216,43.798328190485,Madras Middle School_Coweta County,2015,M
Smokey Road Middle School,Coweta County,783,66.67,34,6,55,0,0,172,0.219667943805875,21713,21.9934601390872,8.22184866209184,63.3158015935154,1.85700732280201,0.0210472988532216,43.798328190485,Smokey Road Middle School_Coweta County,2015,M
East Coweta High School,Coweta County,2851,34.76,23,8,63,0,0.6,226,0.0792704314275693,21713,21.9934601390872,8.22184866209184,63.3158015935154,1.85700732280201,0.0210472988532216,43.798328190485,East Coweta High School_Coweta County,2015,H
Arnall Middle School,Coweta County,909,45.43,28,10,52,0,1.3,39,0.0429042904290429,21713,21.9934601390872,8.22184866209184,63.3158015935154,1.85700732280201,0.0210472988532216,43.798328190485,Arnall Middle School_Coweta County,2015,M
Arnco-Sargent Elementary School,Coweta County,431,65.89,13,9,72,0,5.6,21,0.0487238979118329,21713,21.9934601390872,8.22184866209184,63.3158015935154,1.85700732280201,0.0210472988532216,43.798328190485,Arnco-Sargent Elementary School_Coweta County,2015,E
Ruth Hill Elementary School,Coweta County,414,82.61,43,11,41,0,6.5,48,0.115942028985507,21713,21.9934601390872,8.22184866209184,63.3158015935154,1.85700732280201,0.0210472988532216,43.798328190485,Ruth Hill Elementary School_Coweta County,2015,E
Evans Middle School,Coweta County,760,56.05,24,8,63,0,1.8,102,0.134210526315789,21713,21.9934601390872,8.22184866209184,63.3158015935154,1.85700732280201,0.0210472988532216,43.798328190485,Evans Middle School_Coweta County,2015,M
Atkinson Elementary School,Coweta County,462,62.55,29,11,54,0,4.5,28,0.0606060606060606,21713,21.9934601390872,8.22184866209184,63.3158015935154,1.85700732280201,0.0210472988532216,43.798328190485,Atkinson Elementary School_Coweta County,2015,E
Eastside Elementary School,Coweta County,460,47.17,9,2,84,0,0,18,0.0391304347826087,21713,21.9934601390872,8.22184866209184,63.3158015935154,1.85700732280201,0.0210472988532216,43.798328190485,Eastside Elementary School_Coweta County,2015,E
Northside Elementary School,Coweta County,374,41.71,25,3,70,0,0,16,0.0427807486631016,21713,21.9934601390872,8.22184866209184,63.3158015935154,1.85700732280201,0.0210472988532216,43.798328190485,Northside Elementary School_Coweta County,2015,E
Elm Street Elementary School,Coweta County,477,48.01,27,8,58,0,0,34,0.0712788259958071,21713,21.9934601390872,8.22184866209184,63.3158015935154,1.85700732280201,0.0210472988532216,43.798328190485,Elm Street Elementary School_Coweta County,2015,E
Moreland Elementary School,Coweta County,433,59.12,12,12,70,0,5.5,23,0.0531177829099307,21713,21.9934601390872,8.22184866209184,63.3158015935154,1.85700732280201,0.0210472988532216,43.798328190485,Moreland Elementary School_Coweta County,2015,E
Newnan High School,Coweta County,2246,47.6,28,5,63,0,0.3,474,0.211041852181656,21713,21.9934601390872,8.22184866209184,63.3158015935154,1.85700732280201,0.0210472988532216,43.798328190485,Newnan High School_Coweta County,2015,H
Western Elementary School,Coweta County,379,61.74,30,4,61,0,0,20,0.0527704485488127,21713,21.9934601390872,8.22184866209184,63.3158015935154,1.85700732280201,0.0210472988532216,43.798328190485,Western Elementary School_Coweta County,2015,E
Crawford County Elementary School,Crawford County,801,50.98,21,2,73,0,0,34,0.0424469413233458,1680,22.3339285714286,1.74702380952381,71.6660714285714,0,0,65.0812619047619,Crawford County Elementary School_Crawford County,2015,E
Crawford County High School,Crawford County,454,74.01,25,2,69,0,0,54,0.118942731277533,1680,22.3339285714286,1.74702380952381,71.6660714285714,0,0,65.0812619047619,Crawford County High School_Crawford County,2015,H
Crawford County Middle School,Crawford County,425,82.12,22,1,72,0,0,114,0.268235294117647,1680,22.3339285714286,1.74702380952381,71.6660714285714,0,0,65.0812619047619,Crawford County Middle School_Crawford County,2015,M
Crisp County Primary School,Crisp County,1349,76.28,61,4,30,0,2.9,182,0.134914751667902,4432,53.620036101083,5.26376353790614,37.8808664259928,2.85929602888087,0.282265342960289,79.3417486462094,Crisp County Primary School_Crisp County,2015,E
Crisp County High School,Crisp County,1118,79.49,56,2,40,0,0,449,0.401610017889088,4432,53.620036101083,5.26376353790614,37.8808664259928,2.85929602888087,0.282265342960289,79.3417486462094,Crisp County High School_Crisp County,2015,H
Crisp County Middle School,Crisp County,920,90.68,56,3,37,0,0.5,353,0.383695652173913,4432,53.620036101083,5.26376353790614,37.8808664259928,2.85929602888087,0.282265342960289,79.3417486462094,Crisp County Middle School_Crisp County,2015,M
Crisp County Elementary School,Crisp County,628,67.14,61,4,31,0,0.8,108,0.171974522292994,4432,53.620036101083,5.26376353790614,37.8808664259928,2.85929602888087,0.282265342960289,79.3417486462094,Crisp County Elementary School_Crisp County,2015,E
Crisp County Pre-K,Crisp County,417,82.21,7,25,70,3,18.7,0,0,4432,53.620036101083,5.26376353790614,37.8808664259928,2.85929602888087,0.282265342960289,79.3417486462094,Crisp County Pre-K_Crisp County,2015,E
Dade Elementary School,Dade County,715,62.94,1,2,93,0,0.7,16,0.0223776223776224,2070,0.879710144927536,1.11690821256039,95.3125603864734,0.289903381642512,0,58.9398260869565,Dade Elementary School_Dade County,2015,E
Dade County High School,Dade County,633,49.45,1,1,96,0,0,48,0.0758293838862559,2070,0.879710144927536,1.11690821256039,95.3125603864734,0.289903381642512,0,58.9398260869565,Dade County High School_Dade County,2015,H
Davis Elementary School,Dade County,249,65.86,0,1,97,0,0.4,0,0,2070,0.879710144927536,1.11690821256039,95.3125603864734,0.289903381642512,0,58.9398260869565,Davis Elementary School_Dade County,2015,E
Dade Middle School,Dade County,473,61.95,1,0,97,0,0,75,0.158562367864693,2070,0.879710144927536,1.11690821256039,95.3125603864734,0.289903381642512,0,58.9398260869565,Dade Middle School_Dade County,2015,M
Kilough Elementary School,Dawson County,373,56.03,1,16,81,0,7.8,1,0.00268096514745308,4256,24.6750469924812,11.5711936090226,61.6235902255639,4.51261748120301,0,53.0787922932331,Kilough Elementary School_Dawson County,2015,E
Riverview Middle School,Dawson County,915,69.01,85,9,5,0,0,8,0.00874316939890711,4256,24.6750469924812,11.5711936090226,61.6235902255639,4.51261748120301,0,53.0787922932331,Riverview Middle School_Dawson County,2015,
New Dawson County Middle School,Dawson County,692,58.18,38,30,31,0,20.1,8,0.0115606936416185,4256,24.6750469924812,11.5711936090226,61.6235902255639,4.51261748120301,0,53.0787922932331,New Dawson County Middle School_Dawson County,2015,
Riverview Elementary School,Dawson County,306,50.98,0,3,96,0,0,3,0.00980392156862745,4256,24.6750469924812,11.5711936090226,61.6235902255639,4.51261748120301,0,53.0787922932331,Riverview Elementary School_Dawson County,2015,E
Robinson Elementary School,Dawson County,573,54.97,1,6,91,0,0,36,0.0628272251308901,4256,24.6750469924812,11.5711936090226,61.6235902255639,4.51261748120301,0,53.0787922932331,Robinson Elementary School_Dawson County,2015,E
Dawson County High School,Dawson County,1070,35.61,0,5,91,0,0,66,0.0616822429906542,4256,24.6750469924812,11.5711936090226,61.6235902255639,4.51261748120301,0,53.0787922932331,Dawson County High School_Dawson County,2015,H
Black's Mill Elementary School,Dawson County,327,50.15,0,14,83,0,7.3,8,0.0244648318042813,4256,24.6750469924812,11.5711936090226,61.6235902255639,4.51261748120301,0,53.0787922932331,Black's Mill Elementary School_Dawson County,2015,E
West Bainbridge Elementary School,Decatur County,469,87.21,49,13,34,1,6,5,0.0106609808102345,5004,50.3461231015188,9.19384492406075,37.9722222222222,3.00999200639488,1.00959232613909,84.6224840127898,West Bainbridge Elementary School_Decatur County,2015,E
New Beginning Learning Center,Decatur County,62,94.63,79,5,11,0,1.6,167,2.69354838709677,5004,50.3461231015188,9.19384492406075,37.9722222222222,3.00999200639488,1.00959232613909,84.6224840127898,New Beginning Learning Center_Decatur County,2015,H
Potter Street Elementary School,Decatur County,255,92.99,61,8,28,0,4.7,9,0.0352941176470588,5004,50.3461231015188,9.19384492406075,37.9722222222222,3.00999200639488,1.00959232613909,84.6224840127898,Potter Street Elementary School_Decatur County,2015,E
Elcan-King Elementary School,Decatur County,414,91.11,45,13,39,2,8.5,59,0.142512077294686,5004,50.3461231015188,9.19384492406075,37.9722222222222,3.00999200639488,1.00959232613909,84.6224840127898,Elcan-King Elementary School_Decatur County,2015,
Bainbridge Middle School,Decatur County,780,70.04,47,11,40,1,1.9,155,0.198717948717949,5004,50.3461231015188,9.19384492406075,37.9722222222222,3.00999200639488,1.00959232613909,84.6224840127898,Bainbridge Middle School_Decatur County,2015,M
Hutto Middle School,Decatur County,760,77.23,51,9,37,1,1.7,203,0.267105263157895,5004,50.3461231015188,9.19384492406075,37.9722222222222,3.00999200639488,1.00959232613909,84.6224840127898,Hutto Middle School_Decatur County,2015,E
Bainbridge High School,Decatur County,1413,87.26,51,7,41,1,0.6,159,0.112526539278132,5004,50.3461231015188,9.19384492406075,37.9722222222222,3.00999200639488,1.00959232613909,84.6224840127898,Bainbridge High School_Decatur County,2015,H
John Johnson Elementary School,Decatur County,401,92.99,35,16,46,2,9.5,12,0.029925187032419,5004,50.3461231015188,9.19384492406075,37.9722222222222,3.00999200639488,1.00959232613909,84.6224840127898,John Johnson Elementary School_Decatur County,2015,E
Jones-Wheat Elementary School,Decatur County,450,91.86,63,1,32,0,0,42,0.0933333333333333,5004,50.3461231015188,9.19384492406075,37.9722222222222,3.00999200639488,1.00959232613909,84.6224840127898,Jones-Wheat Elementary School_Decatur County,2015,E
Narvie Harris Elementary School,DeKalb County,815,58.77,99,0,0,0,1.3,39,0.0478527607361963,98109,65.7344484196149,15.7502573668063,10.4783862846426,11.1599730911537,0.00295589599323202,70.1281714215821,Narvie Harris Elementary School_DeKalb County,2015,E
Wynbrooke Elementary School,DeKalb County,725,56.28,98,1,0,0,0.7,35,0.0482758620689655,98109,65.7344484196149,15.7502573668063,10.4783862846426,11.1599730911537,0.00295589599323202,70.1281714215821,Wynbrooke Elementary School_DeKalb County,2015,E
"Martin Luther King, Jr. High School",DeKalb County,1668,85.4,97,1,0,0,0.4,1161,0.696043165467626,98109,65.7344484196149,15.7502573668063,10.4783862846426,11.1599730911537,0.00295589599323202,70.1281714215821,"Martin Luther King, Jr. High School_DeKalb County",2015,H
Miller Grove High School,DeKalb County,1551,79.3,97,2,0,0,0.6,941,0.606705351386203,98109,65.7344484196149,15.7502573668063,10.4783862846426,11.1599730911537,0.00295589599323202,70.1281714215821,Miller Grove High School_DeKalb County,2015,H
Flat Rock Elementary School,DeKalb County,1006,83.1,94,3,0,0,1,99,0.0984095427435388,98109,65.7344484196149,15.7502573668063,10.4783862846426,11.1599730911537,0.00295589599323202,70.1281714215821,Flat Rock Elementary School_DeKalb County,2015,E
Princeton Elementary School,DeKalb County,902,82.48,94,3,1,0,0,73,0.0809312638580931,98109,65.7344484196149,15.7502573668063,10.4783862846426,11.1599730911537,0.00295589599323202,70.1281714215821,Princeton Elementary School_DeKalb County,2015,E
Destiny Achievers Academy of Excellence,DeKalb County,114,87.72,97,1,0,0,0,5,0.043859649122807,98109,65.7344484196149,15.7502573668063,10.4783862846426,11.1599730911537,0.00295589599323202,70.1281714215821,Destiny Achievers Academy of Excellence_DeKalb County,2015,
DeKalb Preparatory Academy Charter,DeKalb County,457,77.9,95,1,0,0,0,93,0.203501094091904,98109,65.7344484196149,15.7502573668063,10.4783862846426,11.1599730911537,0.00295589599323202,70.1281714215821,DeKalb Preparatory Academy Charter_DeKalb County,2015,E
Cedar Grove High School,DeKalb County,1014,80.67,98,1,0,0,0.4,503,0.496055226824458,98109,65.7344484196149,15.7502573668063,10.4783862846426,11.1599730911537,0.00295589599323202,70.1281714215821,Cedar Grove High School_DeKalb County,2015,H
Vanderlyn Elementary School,DeKalb County,691,31.33,3,4,56,0,6.1,2,0.00289435600578871,98109,65.7344484196149,15.7502573668063,10.4783862846426,11.1599730911537,0.00295589599323202,70.1281714215821,Vanderlyn Elementary School_DeKalb County,2015,E
Austin Elementary School,DeKalb County,615,12.18,3,6,74,0,4.2,0,0,98109,65.7344484196149,15.7502573668063,10.4783862846426,11.1599730911537,0.00295589599323202,70.1281714215821,Austin Elementary School_DeKalb County,2015,E
Redan High School,DeKalb County,1107,81.48,94,3,0,0,1,525,0.474254742547426,98109,65.7344484196149,15.7502573668063,10.4783862846426,11.1599730911537,0.00295589599323202,70.1281714215821,Redan High School_DeKalb County,2015,H
Eldridge L. Miller Elementary School,DeKalb County,533,92.87,95,3,0,0,0.8,107,0.200750469043152,98109,65.7344484196149,15.7502573668063,10.4783862846426,11.1599730911537,0.00295589599323202,70.1281714215821,Eldridge L. Miller Elementary School_DeKalb County,2015,E
Panola Way Elementary School,DeKalb County,819,89.13,96,2,0,0,1.6,260,0.317460317460317,98109,65.7344484196149,15.7502573668063,10.4783862846426,11.1599730911537,0.00295589599323202,70.1281714215821,Panola Way Elementary School_DeKalb County,2015,E
Peachtree Middle School,DeKalb County,1398,37.48,18,28,45,0,8.8,102,0.0729613733905579,98109,65.7344484196149,15.7502573668063,10.4783862846426,11.1599730911537,0.00295589599323202,70.1281714215821,Peachtree Middle School_DeKalb County,2015,M
Pine Ridge Elementary School,DeKalb County,570,87.37,95,2,1,0,3.2,96,0.168421052631579,98109,65.7344484196149,15.7502573668063,10.4783862846426,11.1599730911537,0.00295589599323202,70.1281714215821,Pine Ridge Elementary School_DeKalb County,2015,E
Browns Mill Elementary School,DeKalb County,690,85.22,96,3,1,0,0.7,79,0.114492753623188,98109,65.7344484196149,15.7502573668063,10.4783862846426,11.1599730911537,0.00295589599323202,70.1281714215821,Browns Mill Elementary School_DeKalb County,2015,E
Chapel Hill Middle School,DeKalb County,854,79.98,97,1,1,0,0.5,671,0.785714285714286,98109,65.7344484196149,15.7502573668063,10.4783862846426,11.1599730911537,0.00295589599323202,70.1281714215821,Chapel Hill Middle School_DeKalb County,2015,M
Marbut Elementary School,DeKalb County,729,82.99,97,2,0,0,1.1,19,0.0260631001371742,98109,65.7344484196149,15.7502573668063,10.4783862846426,11.1599730911537,0.00295589599323202,70.1281714215821,Marbut Elementary School_DeKalb County,2015,E
Cedar Grove Middle School,DeKalb County,864,92.71,97,1,0,0,0.1,730,0.844907407407407,98109,65.7344484196149,15.7502573668063,10.4783862846426,11.1599730911537,0.00295589599323202,70.1281714215821,Cedar Grove Middle School_DeKalb County,2015,M
Freedom Middle School,DeKalb County,1240,77.74,63,3,3,0,28.6,1017,0.820161290322581,98109,65.7344484196149,15.7502573668063,10.4783862846426,11.1599730911537,0.00295589599323202,70.1281714215821,Freedom Middle School_DeKalb County,2015,M
Lithonia High School,DeKalb County,1315,86.39,95,4,0,0,0.6,599,0.455513307984791,98109,65.7344484196149,15.7502573668063,10.4783862846426,11.1599730911537,0.00295589599323202,70.1281714215821,Lithonia High School_DeKalb County,2015,H
Lithonia Middle School,DeKalb County,1158,88.95,93,5,1,0,1.2,679,0.586355785837651,98109,65.7344484196149,15.7502573668063,10.4783862846426,11.1599730911537,0.00295589599323202,70.1281714215821,Lithonia Middle School_DeKalb County,2015,M
